{
  "id": "SCN-066",
  "type": "scenario",
  "title": "Start an authorized release and publish the qualified packages",
  "status": "confirmed",
  "actor": "A maintainer authorized to initiate a supported release",
  "goal": "Start publication of reviewed release input once and receive the checked public outcome without another approval.",
  "context": "Reviewed release intent and supported publication setup are established; actual packages will be prepared and checked by the release operation.",
  "trigger": "The maintainer initiates the authorized release workflow for the selected reviewed source.",
  "preconditions": [
    "Reviewed source, version intent, publication destinations and permitted workflow are identified.",
    "The maintainer has authority to initiate this release; required setup is established."
  ],
  "interaction": [
    {
      "actor": "Maintainer",
      "action": "Initiates the supported release operation for the selected reviewed source and configured destinations."
    },
    {
      "actor": "System",
      "action": "Prepares, checks and retains the exact packages, showing their identities and check results."
    },
    {
      "actor": "System",
      "action": "Publishes the retained qualified packages without asking for another approval and reports actual public verification and closeout."
    }
  ],
  "expected_outcome": "The authorized start leads to qualified publication and an honest result without an intervening human approval.",
  "alternatives": [
    {
      "condition": "The same operation is retried after interruption.",
      "outcome": "The original retained packages and observed public state determine the remaining authorized work; no redundant approval or duplicate publication."
    }
  ],
  "failures": [
    {
      "condition": "Candidate bytes, source, configuration, destinations, or required evidence change materially or become invalid.",
      "outcome": "Publication stops until affected requalification and applicable authorization address the new subject."
    },
    {
      "condition": "A conflicting public tag/artifact, missing authentication prerequisite, or unavailable authorization is found.",
      "outcome": "The operation stops without overwrite or unapproved fallback."
    },
    {
      "condition": "An external write is uncertain.",
      "outcome": "Known effects are recorded and public state must be inspected before any retry."
    },
    {
      "condition": "A requested special release lies outside routine automation.",
      "outcome": "Its need for an explicit supported owner disposition is reported rather than relabeling it routine."
    },
    {
      "condition": "A required check fails, or execution comes from local checks, PR validation or an unauthorized trigger.",
      "outcome": "Publication is blocked; workflow execution or a passing unrelated check cannot manufacture authority."
    }
  ],
  "exercises": [
    "FEAT-020"
  ],
  "informs": [
    "SR-069",
    "SR-070",
    "SR-071",
    "SR-072",
    "SR-073",
    "SR-007"
  ],
  "sources": [
    {
      "source": "SRC-PUBLISHED-RELEASE",
      "locator": "design/architecture/modules/MOD-019-product-delivery/modules/MOD-015-product-release-coordination/release.md#REL-SR-11",
      "basis": "IR-010 owns this stakeholder situation. It exercises the selected published-product capability while preserving the source contract's observable success and adverse outcomes."
    },
    {
      "source": "SRC-PUBLISHED-RELEASE",
      "locator": "design/architecture/modules/MOD-019-product-delivery/modules/MOD-015-product-release-coordination/release.md#REL-SR-12",
      "basis": "IR-010 owns this stakeholder situation. It exercises the selected published-product capability while preserving the source contract's observable success and adverse outcomes."
    },
    {
      "source": "SRC-PUBLISHED-RELEASE",
      "locator": "design/architecture/modules/MOD-019-product-delivery/modules/MOD-015-product-release-coordination/release.md#REL-SR-22",
      "basis": "IR-010 owns this stakeholder situation. It exercises the selected published-product capability while preserving the source contract's observable success and adverse outcomes."
    },
    {
      "source": "SRC-PUBLISHED-RELEASE",
      "locator": "design/architecture/modules/MOD-019-product-delivery/modules/MOD-015-product-release-coordination/release.md#REL-SR-23",
      "basis": "IR-010 owns this stakeholder situation. It exercises the selected published-product capability while preserving the source contract's observable success and adverse outcomes."
    },
    {
      "source": "SRC-PUBLISHED-RELEASE",
      "locator": "design/architecture/modules/MOD-019-product-delivery/modules/MOD-015-product-release-coordination/release.md#REL-SR-24",
      "basis": "IR-010 owns this stakeholder situation. It exercises the selected published-product capability while preserving the source contract's observable success and adverse outcomes."
    },
    {
      "source": "SRC-PUBLISHED-PRODUCTS",
      "locator": "SCN-066; design/requirements/published-products.md#review-and-validation",
      "basis": "Independent review and author reconciliation confirmed this stakeholder situation, primary Feature, and SR coverage as current analysis knowledge. This does not approve requirements or establish implemented behavior or satisfaction."
    },
    {
      "source": "SRC-PUBLISHED-RELEASE",
      "locator": "user-request:2026-10-04-release-workflow-start-authority",
      "basis": "User selects initiation of the authorized release workflow as publication authority, with no later routine approval. Refines the existing IR-010 need; exact candidate qualification, bounded authority and recovery remain. Design change only; running workflow adoption requires implementation."
    }
  ]
}
